{
  "dataset_id": "curated_5feeds_smoke_v1",
  "run_id": "autoresearch_prompt_ollama_mistral_small3_2_smoke_bullets_v1",
  "episode_count": 5,
  "intrinsic": {
    "gates": {
      "boilerplate_leak_rate": 0.0,
      "speaker_label_leak_rate": 0.0,
      "truncation_rate": 0.0,
      "failed_episodes": [],
      "episode_gate_failures": {}
    },
    "warnings": {
      "speaker_name_leak_rate": 0.0
    },
    "length": {
      "avg_tokens": 215.8,
      "min_tokens": 205,
      "max_tokens": 232
    },
    "performance": {
      "avg_latency_ms": 30527.47893333435,
      "median_latency_ms": 29418.72501373291,
      "p95_latency_ms": 35867.31576919556,
      "avg_latency_ms_excluding_first": 29192.51972436905
    }
  },
  "vs_reference": {
    "silver_sonnet46_smoke_bullets_v1": {
      "reference_quality": "silver",
      "rouge1_f1": 0.6202489300263536,
      "rouge2_f1": 0.3554892119810027,
      "rougeL_f1": 0.3490883408131554,
      "bleu": 0.29164034310063713,
      "wer": 0.8247790825811208,
      "embedding_cosine": 0.8583353757858276,
      "coverage_ratio": 0.573936170212766,
      "numbers_retained": 1.0
    }
  },
  "schema": "metrics_summarization_v2",
  "task": "summarization"
}